{
  "$schema": "https://modellang.dev/schemas/target-capability-profile.schema.json",
  "profileVersion": 9,
  "compilerVersion": "0.45.0",
  "generatorProfile": "postgresql-http-ui-extension-tools/29",
  "targetProfile": "target:postgresql-http-ui-extension-tools/9",
  "irVersion": 1,
  "model": {
    "id": "model:Reservations",
    "version": "0.45.0",
    "sourceHash": "sha256:5debacf51df6a907423f7978dda56df35ba89fb7f985d1af897654521a03c499"
  },
  "conformance": "complete",
  "authority": "none",
  "capabilities": [
    {
      "id": "core.stableIdentity",
      "required": true,
      "support": "native",
      "enforcement": [
        "compiler",
        "canonical-ir",
        "semantic-diff"
      ]
    },
    {
      "id": "core.typedState",
      "required": true,
      "support": "native",
      "enforcement": [
        "compiler",
        "postgresql",
        "typescript"
      ]
    },
    {
      "id": "operations.authenticatedActions",
      "required": true,
      "support": "native",
      "enforcement": [
        "postgresql",
        "http"
      ]
    },
    {
      "id": "operations.reliableCommands",
      "required": true,
      "support": "native",
      "enforcement": [
        "postgresql",
        "http"
      ]
    },
    {
      "id": "policy.closedBoolean",
      "required": false,
      "support": "native",
      "enforcement": [
        "compiler",
        "postgresql"
      ]
    },
    {
      "id": "events.transactionalOutbox",
      "required": true,
      "support": "native",
      "enforcement": [
        "postgresql",
        "typescript"
      ]
    },
    {
      "id": "events.transactionalConsumers",
      "required": true,
      "support": "native",
      "enforcement": [
        "postgresql",
        "typescript"
      ]
    },
    {
      "id": "queries.closedProjections",
      "required": true,
      "support": "native",
      "enforcement": [
        "postgresql",
        "http",
        "ui-metadata"
      ]
    },
    {
      "id": "queries.toOneTraversal",
      "required": true,
      "support": "native",
      "enforcement": [
        "compiler",
        "postgresql",
        "http"
      ]
    },
    {
      "id": "queries.optionalFilters",
      "required": true,
      "support": "native",
      "enforcement": [
        "compiler",
        "postgresql",
        "http"
      ]
    },
    {
      "id": "queries.authoredSortProfiles",
      "required": true,
      "support": "native",
      "enforcement": [
        "compiler",
        "postgresql",
        "http"
      ]
    },
    {
      "id": "queries.cursorPagination",
      "required": true,
      "support": "native",
      "enforcement": [
        "postgresql",
        "http"
      ]
    },
    {
      "id": "queries.conditionalDisclosure",
      "required": false,
      "support": "native",
      "enforcement": [
        "compiler",
        "postgresql",
        "http"
      ]
    },
    {
      "id": "queries.transactionalReadEvidence",
      "required": false,
      "support": "native",
      "enforcement": [
        "postgresql"
      ]
    },
    {
      "id": "agents.staticToolCatalog",
      "required": true,
      "support": "native",
      "enforcement": [
        "agent-tool-catalog",
        "http"
      ]
    },
    {
      "id": "agents.subjectCapabilityView",
      "required": true,
      "support": "native",
      "enforcement": [
        "agent-tool-catalog",
        "http",
        "postgresql-applicability"
      ]
    },
    {
      "id": "agents.currentStateResources",
      "required": true,
      "support": "native",
      "enforcement": [
        "agent-tool-catalog",
        "http",
        "postgresql-query"
      ]
    },
    {
      "id": "agents.mcpAdapter",
      "required": true,
      "support": "native",
      "enforcement": [
        "mcp",
        "agent-tool-catalog",
        "postgresql-runtime"
      ]
    },
    {
      "id": "agents.taskPackets",
      "required": true,
      "support": "native",
      "enforcement": [
        "agent-task-packet",
        "http",
        "mcp",
        "postgresql-runtime"
      ]
    },
    {
      "id": "agents.delegatedCapabilities",
      "required": true,
      "support": "native",
      "enforcement": [
        "delegated-capability",
        "http",
        "mcp",
        "host-credential-authority",
        "postgresql-runtime"
      ]
    },
    {
      "id": "agents.publicDecisionTraces",
      "required": true,
      "support": "native",
      "enforcement": [
        "public-decision-trace",
        "http",
        "mcp",
        "postgresql-applicability"
      ]
    },
    {
      "id": "agents.extensionToolAdapter",
      "required": false,
      "support": "native",
      "enforcement": [
        "agent-tool-catalog",
        "http",
        "mcp",
        "host-extension-adapter",
        "host-contract-tests"
      ]
    },
    {
      "id": "extensions.declaredExternal",
      "required": false,
      "support": "externalImplementationRequired",
      "enforcement": [
        "extension-ledger",
        "host-conformance-tests"
      ]
    }
  ],
  "gaps": []
}
